tutorials/autotvm/conv2d.log
{"input": ["cuda", "tutorial/conv2d_no_batching", [1, 7, 7, 512, 512, 3, 3, [1, 1], [1, 1]], {}], "config": {"index": 9582035, "code_hash": null, "entity": [["tile_f", "sp", [-1, 2, 8, 8]], ["tile_y", "sp", [-1, 1, 7, 1]], ["tile_x", "sp", [-1, 1, 1, 1]], ["tile_rc", "sp", [-1, 1, 8]], ["tile_ry", "sp", [-1, 3, 1]], ["tile_rx", "sp", [-1, 3, 1]], ["auto_unroll_max_step", "ot", 1500], ["unroll_explicit", "ot", 1]]}, "result": [[0.001830125287878788], 0, 1.8532698154449463, 1587057043.8632317], "version": 0.2, "tvm_version": "0.7.dev1"}
{"input": ["cuda", "tutorial/conv2d_no_batching", [1, 7, 7, 512, 512, 3, 3, [1, 1], [1, 1]], {}], "config": {"index": 8176647, "code_hash": null, "entity": [["tile_f", "sp", [-1, 2, 16, 4]], ["tile_y", "sp", [-1, 1, 7, 1]], ["tile_x", "sp", [-1, 1, 1, 7]], ["tile_rc", "sp", [-1, 4, 2]], ["tile_ry", "sp", [-1, 1, 1]], ["tile_rx", "sp", [-1, 1, 3]], ["auto_unroll_max_step", "ot", 512], ["unroll_explicit", "ot", 1]]}, "result": [[0.0012288230795454546], 0, 1.4173846244812012, 1587057044.648423], "version": 0.2, "tvm_version": "0.7.dev1"}
{"input": ["cuda", "tutorial/conv2d_no_batching", [1, 7, 7, 512, 512, 3, 3, [1, 1], [1, 1]], {}], "config": {"index": 1745041, "code_hash": null, "entity": [["tile_f", "sp", [-1, 2, 1, 1]], ["tile_y", "sp", [-1, 1, 1, 1]], ["tile_x", "sp", [-1, 1, 1, 7]], ["tile_rc", "sp", [-1, 1, 1]], ["tile_ry", "sp", [-1, 1, 1]], ["tile_rx", "sp", [-1, 1, 1]], ["auto_unroll_max_step", "ot", 512], ["unroll_explicit", "ot", 0]]}, "result": [[0.010720345636363636], 0, 1.1603095531463623, 1587057049.6923378], "version": 0.2, "tvm_version": "0.7.dev1"}
{"input": ["cuda", "tutorial/conv2d_no_batching", [1, 7, 7, 512, 512, 3, 3, [1, 1], [1, 1]], {}], "config": {"index": 1065124, "code_hash": null, "entity": [["tile_f", "sp", [-1, 16, 1, 4]], ["tile_y", "sp", [-1, 7, 1, 1]], ["tile_x", "sp", [-1, 1, 7, 1]], ["tile_rc", "sp", [-1, 1, 8]], ["tile_ry", "sp", [-1, 1, 3]], ["tile_rx", "sp", [-1, 3, 1]], ["auto_unroll_max_step", "ot", 0], ["unroll_explicit", "ot", 0]]}, "result": [[0.04655464775], 0, 1.7297468185424805, 1587057051.5633917], "version": 0.2, "tvm_version": "0.7.dev1"}
{"input": ["cuda", "tutorial/conv2d_no_batching", [1, 7, 7, 512, 512, 3, 3, [1, 1], [1, 1]], {}], "config": {"index": 5458568, "code_hash": null, "entity": [["tile_f", "sp", [-1, 32, 2, 8]], ["tile_y", "sp", [-1, 1, 1, 7]], ["tile_x", "sp", [-1, 1, 7, 1]], ["tile_rc", "sp", [-1, 1, 2]], ["tile_ry", "sp", [-1, 3, 1]], ["tile_rx", "sp", [-1, 1, 1]], ["auto_unroll_max_step", "ot", 0], ["unroll_explicit", "ot", 1]]}, "result": [[0.13553383975], 0, 2.74446702003479, 1587057053.7869506], "version": 0.2, "tvm_version": "0.7.dev1"}
