tutorials/frontend/resnet-50_i.log
{"input": ["cuda -model=unknown", "conv2d_NCHWc_int8.cuda", [["TENSOR", [1, 1024, 14, 14], "int8"], ["TENSOR", [2048, 1024, 1, 1], "int8"], [2, 2], [0, 0, 0, 0], [1, 1], "NCHW", "int32"], {}], "config": {"index": 4011287, "code_hash": null, "entity": [["tile_n", "sp", [-1, 1, 1, 1]], ["tile_f", "sp", [-1, 1, 8, 1]], ["tile_y", "sp", [-1, 7, 1, 1]], ["tile_x", "sp", [-1, 1, 7, 1]], ["fuse_yx", "ot", 1], ["tile_rc", "sp", [-1, 4]], ["tile_ry", "sp", [-1, 1]], ["tile_rx", "sp", [-1, 1]], ["reorder_inner", "re", [1, 2, 0]], ["AA_double_buffer", "ot", 0], ["WW_double_buffer", "ot", 1], ["auto_unroll_max_step", "ot", 1500]]}, "result": [[3.939302578796562e-05], 0, 1.603424072265625, 1587075300.0305429], "version": 0.2, "tvm_version": "0.7.dev1"}
{"input": ["cuda -model=unknown", "conv2d_NCHWc_int8.cuda", [["TENSOR", [1, 512, 28, 28], "int8"], ["TENSOR", [1024, 512, 1, 1], "int8"], [2, 2], [0, 0, 0, 0], [1, 1], "NCHW", "int32"], {}], "config": {"index": 27139547, "code_hash": null, "entity": [["tile_n", "sp", [-1, 1, 1, 1]], ["tile_f", "sp", [-1, 1, 4, 1]], ["tile_y", "sp", [-1, 7, 1, 1]], ["tile_x", "sp", [-1, 1, 14, 1]], ["fuse_yx", "ot", 0], ["tile_rc", "sp", [-1, 2]], ["tile_ry", "sp", [-1, 1]], ["tile_rx", "sp", [-1, 1]], ["reorder_inner", "re", [2, 0, 1]], ["AA_double_buffer", "ot", 0], ["WW_double_buffer", "ot", 1], ["auto_unroll_max_step", "ot", 512]]}, "result": [[4.994718835944995e-05], 0, 1.4817173480987549, 1587076344.7715454], "version": 0.2, "tvm_version": "0.7.dev1"}
{"input": ["cuda -model=unknown", "conv2d_NCHWc_int8.cuda", [["TENSOR", [1, 256, 56, 56], "int8"], ["TENSOR", [512, 256, 1, 1], "int8"], [2, 2], [0, 0, 0, 0], [1, 1], "NCHW", "int32"], {}], "config": {"index": 70708831, "code_hash": null, "entity": [["tile_n", "sp", [-1, 1, 1, 1]], ["tile_f", "sp", [-1, 2, 32, 1]], ["tile_y", "sp", [-1, 1, 1, 1]], ["tile_x", "sp", [-1, 7, 4, 1]], ["fuse_yx", "ot", 0], ["tile_rc", "sp", [-1, 4]], ["tile_ry", "sp", [-1, 1]], ["tile_rx", "sp", [-1, 1]], ["reorder_inner", "re", [1, 0, 2]], ["AA_double_buffer", "ot", 0], ["WW_double_buffer", "ot", 0], ["auto_unroll_max_step", "ot", 512]]}, "result": [[2.7367323257918555e-05], 0, 1.2370965480804443, 1587079585.1637683], "version": 0.2, "tvm_version": "0.7.dev1"}
{"input": ["cuda -model=unknown", "conv2d_nchw.cuda", [["TENSOR", [1, 3, 224, 224], "float32"], ["TENSOR", [64, 3, 7, 7], "float32"], [2, 2], [3, 3, 3, 3], [1, 1], "float32"], {}], "config": {"index": 72880728, "code_hash": null, "entity": [["tile_f", "sp", [-1, 4, 4, 4]], ["tile_y", "sp", [-1, 4, 1, 2]], ["tile_x", "sp", [-1, 1, 16, 1]], ["tile_rc", "sp", [-1, 1]], ["tile_ry", "sp", [-1, 1]], ["tile_rx", "sp", [-1, 7]], ["auto_unroll_max_step", "ot", 1500], ["unroll_explicit", "ot", 1]]}, "result": [[7.831036549259826e-05], 0, 3.1958916187286377, 1587081908.589276], "version": 0.2, "tvm_version": "0.7.dev1"}
{"input": ["cuda -model=unknown", "conv2d_NCHWc_int8.cuda", [["TENSOR", [1, 64, 56, 56], "int8"], ["TENSOR", [64, 64, 1, 1], "int8"], [1, 1], [0, 0, 0, 0], [1, 1], "NCHW", "int32"], {}], "config": {"index": 97053717, "code_hash": null, "entity": [["tile_n", "sp", [-1, 1, 1, 1]], ["tile_f", "sp", [-1, 1, 8, 1]], ["tile_y", "sp", [-1, 7, 1, 1]], ["tile_x", "sp", [-1, 1, 8, 1]], ["fuse_yx", "ot", 1], ["tile_rc", "sp", [-1, 2]], ["tile_ry", "sp", [-1, 1]], ["tile_rx", "sp", [-1, 1]], ["reorder_inner", "re", [0, 2, 1]], ["AA_double_buffer", "ot", 1], ["WW_double_buffer", "ot", 1], ["auto_unroll_max_step", "ot", 512]]}, "result": [[4.715479651575002e-06], 0, 2.037565231323242, 1587084018.6208515], "version": 0.2, "tvm_version": "0.7.dev1"}
{"input": ["cuda -model=unknown", "conv2d_NCHWc_int8.cuda", [["TENSOR", [1, 256, 56, 56], "int8"], ["TENSOR", [64, 256, 1, 1], "int8"], [1, 1], [0, 0, 0, 0], [1, 1], "NCHW", "int32"], {}], "config": {"index": 98176414, "code_hash": null, "entity": [["tile_n", "sp", [-1, 1, 1, 1]], ["tile_f", "sp", [-1, 1, 16, 1]], ["tile_y", "sp", [-1, 1, 1, 1]], ["tile_x", "sp", [-1, 7, 8, 1]], ["fuse_yx", "ot", 0], ["tile_rc", "sp", [-1, 4]], ["tile_ry", "sp", [-1, 1]], ["tile_rx", "sp", [-1, 1]], ["reorder_inner", "re", [0, 2, 1]], ["AA_double_buffer", "ot", 1], ["WW_double_buffer", "ot", 0], ["auto_unroll_max_step", "ot", 512]]}, "result": [[1.0878175068441423e-05], 0, 1.822356939315796, 1587085796.9980261], "version": 0.2, "tvm_version": "0.7.dev1"}
{"input": ["cuda -model=unknown", "conv2d_nchw_winograd.cuda", [["TENSOR", [1, 64, 56, 56], "int8"], ["TENSOR", [64, 64, 3, 3], "int8"], [1, 1], [1, 1, 1, 1], [1, 1], "int32"], {}], "config": {"index": 145307, "code_hash": null, "entity": [["tile_b", "sp", [-1, 1, 1, 1]], ["tile_y", "sp", [-1, 1, 4, 8]], ["tile_x", "sp", [-1, 7, 28, 1]], ["tile_rc", "sp", [-1, 8]], ["auto_unroll_max_step", "ot", 1500], ["unroll_explicit", "ot", 0]]}, "result": [[3.6339533518905126e-05], 0, 2.8698675632476807, 1587088726.7825027], "version": 0.2, "tvm_version": "0.7.dev1"}
{"input": ["cuda -model=unknown", "conv2d_NCHWc_int8.cuda", [["TENSOR", [1, 64, 56, 56], "int8"], ["TENSOR", [64, 64, 3, 3], "int8"], [1, 1], [1, 1, 1, 1], [1, 1], "NCHW", "int32"], {}], "config": {"index": 532071694, "code_hash": null, "entity": [["tile_n", "sp", [-1, 1, 1, 1]], ["tile_f", "sp", [-1, 1, 16, 1]], ["tile_y", "sp", [-1, 1, 1, 4]], ["tile_x", "sp", [-1, 2, 14, 1]], ["fuse_yx", "ot", 1], ["tile_rc", "sp", [-1, 4]], ["tile_ry", "sp", [-1, 3]], ["tile_rx", "sp", [-1, 1]], ["reorder_inner", "re", [2, 1, 0]], ["AA_double_buffer", "ot", 1], ["WW_double_buffer", "ot", 0], ["auto_unroll_max_step", "ot", 1500]]}, "result": [[1.9261587978982445e-05], 0, 2.6308608055114746, 1587092302.0134478], "version": 0.2, "tvm_version": "0.7.dev1"}
{"input": ["cuda -model=unknown", "conv2d_NCHWc_int8.cuda", [["TENSOR", [1, 64, 56, 56], "int8"], ["TENSOR", [256, 64, 1, 1], "int8"], [1, 1], [0, 0, 0, 0], [1, 1], "NCHW", "int32"], {}], "config": {"index": 324864982, "code_hash": null, "entity": [["tile_n", "sp", [-1, 1, 1, 1]], ["tile_f", "sp", [-1, 1, 16, 1]], ["tile_y", "sp", [-1, 1, 1, 1]], ["tile_x", "sp", [-1, 7, 8, 1]], ["fuse_yx", "ot", 0], ["tile_rc", "sp", [-1, 4]], ["tile_ry", "sp", [-1, 1]], ["tile_rx", "sp", [-1, 1]], ["reorder_inner", "re", [0, 1, 2]], ["AA_double_buffer", "ot", 0], ["WW_double_buffer", "ot", 1], ["auto_unroll_max_step", "ot", 1500]]}, "result": [[1.3981409635299414e-05], 0, 1.8200697898864746, 1587095542.1935077], "version": 0.2, "tvm_version": "0.7.dev1"}
{"input": ["cuda -model=unknown", "conv2d_NCHWc_int8.cuda", [["TENSOR", [1, 256, 56, 56], "int8"], ["TENSOR", [128, 256, 1, 1], "int8"], [1, 1], [0, 0, 0, 0], [1, 1], "NCHW", "int32"], {}], "config": {"index": 162099858, "code_hash": null, "entity": [["tile_n", "sp", [-1, 1, 1, 1]], ["tile_f", "sp", [-1, 1, 16, 1]], ["tile_y", "sp", [-1, 1, 1, 1]], ["tile_x", "sp", [-1, 7, 8, 1]], ["fuse_yx", "ot", 0], ["tile_rc", "sp", [-1, 4]], ["tile_ry", "sp", [-1, 1]], ["tile_rx", "sp", [-1, 1]], ["reorder_inner", "re", [1, 0, 2]], ["AA_double_buffer", "ot", 1], ["WW_double_buffer", "ot", 0], ["auto_unroll_max_step", "ot", 512]]}, "result": [[1.9729718791834003e-05], 0, 1.7056186199188232, 1587096639.9711344], "version": 0.2, "tvm_version": "0.7.dev1"}
{"input": ["cuda -model=unknown", "conv2d_NCHWc_int8.cuda", [["TENSOR", [1, 128, 56, 56], "int8"], ["TENSOR", [128, 128, 3, 3], "int8"], [2, 2], [1, 1, 1, 1], [1, 1], "NCHW", "int32"], {}], "config": {"index": 287292730, "code_hash": null, "entity": [["tile_n", "sp", [-1, 1, 1, 1]], ["tile_f", "sp", [-1, 1, 16, 1]], ["tile_y", "sp", [-1, 1, 1, 4]], ["tile_x", "sp", [-1, 1, 14, 1]], ["fuse_yx", "ot", 0], ["tile_rc", "sp", [-1, 2]], ["tile_ry", "sp", [-1, 3]], ["tile_rx", "sp", [-1, 3]], ["reorder_inner", "re", [0, 1, 2]], ["AA_double_buffer", "ot", 1], ["WW_double_buffer", "ot", 1], ["auto_unroll_max_step", "ot", 1500]]}, "result": [[2.602370031409076e-05], 0, 2.29132342338562, 1587099242.5757198], "version": 0.2, "tvm_version": "0.7.dev1"}
{"input": ["cuda -model=unknown", "conv2d_NCHWc_int8.cuda", [["TENSOR", [1, 512, 28, 28], "int8"], ["TENSOR", [128, 512, 1, 1], "int8"], [1, 1], [0, 0, 0, 0], [1, 1], "NCHW", "int32"], {}], "config": {"index": 96972194, "code_hash": null, "entity": [["tile_n", "sp", [-1, 1, 1, 1]], ["tile_f", "sp", [-1, 1, 16, 1]], ["tile_y", "sp", [-1, 1, 2, 1]], ["tile_x", "sp", [-1, 7, 4, 1]], ["fuse_yx", "ot", 0], ["tile_rc", "sp", [-1, 32]], ["tile_ry", "sp", [-1, 1]], ["tile_rx", "sp", [-1, 1]], ["reorder_inner", "re", [0, 2, 1]], ["AA_double_buffer", "ot", 1], ["WW_double_buffer", "ot", 1], ["auto_unroll_max_step", "ot", 1500]]}, "result": [[1.2916002096210697e-05], 0, 3.8320157527923584, 1587101774.3054922], "version": 0.2, "tvm_version": "0.7.dev1"}
{"input": ["cuda -model=unknown", "conv2d_nchw_winograd.cuda", [["TENSOR", [1, 128, 28, 28], "int8"], ["TENSOR", [128, 128, 3, 3], "int8"], [1, 1], [1, 1, 1, 1], [1, 1], "int32"], {}], "config": {"index": 242003, "code_hash": null, "entity": [["tile_b", "sp", [-1, 1, 1, 1]], ["tile_y", "sp", [-1, 2, 16, 4]], ["tile_x", "sp", [-1, 7, 4, 1]], ["tile_rc", "sp", [-1, 16]], ["auto_unroll_max_step", "ot", 1500], ["unroll_explicit", "ot", 0]]}, "result": [[4.4547452367531006e-05], 0, 2.03741455078125, 1587104868.2805867], "version": 0.2, "tvm_version": "0.7.dev1"}
{"input": ["cuda -model=unknown", "conv2d_NCHWc_int8.cuda", [["TENSOR", [1, 128, 28, 28], "int8"], ["TENSOR", [128, 128, 3, 3], "int8"], [1, 1], [1, 1, 1, 1], [1, 1], "NCHW", "int32"], {}], "config": {"index": 149667130, "code_hash": null, "entity": [["tile_n", "sp", [-1, 1, 1, 1]], ["tile_f", "sp", [-1, 1, 16, 1]], ["tile_y", "sp", [-1, 1, 1, 4]], ["tile_x", "sp", [-1, 1, 14, 1]], ["fuse_yx", "ot", 0], ["tile_rc", "sp", [-1, 2]], ["tile_ry", "sp", [-1, 3]], ["tile_rx", "sp", [-1, 3]], ["reorder_inner", "re", [2, 0, 1]], ["AA_double_buffer", "ot", 1], ["WW_double_buffer", "ot", 0], ["auto_unroll_max_step", "ot", 512]]}, "result": [[1.978129782701321e-05], 0, 2.058934450149536, 1587106850.436478], "version": 0.2, "tvm_version": "0.7.dev1"}
{"input": ["cuda -model=unknown", "conv2d_NCHWc_int8.cuda", [["TENSOR", [1, 128, 28, 28], "int8"], ["TENSOR", [512, 128, 1, 1], "int8"], [1, 1], [0, 0, 0, 0], [1, 1], "NCHW", "int32"], {}], "config": {"index": 107604915, "code_hash": null, "entity": [["tile_n", "sp", [-1, 1, 1, 1]], ["tile_f", "sp", [-1, 1, 4, 4]], ["tile_y", "sp", [-1, 1, 1, 4]], ["tile_x", "sp", [-1, 1, 28, 1]], ["fuse_yx", "ot", 0], ["tile_rc", "sp", [-1, 16]], ["tile_ry", "sp", [-1, 1]], ["tile_rx", "sp", [-1, 1]], ["reorder_inner", "re", [2, 0, 1]], ["AA_double_buffer", "ot", 1], ["WW_double_buffer", "ot", 1], ["auto_unroll_max_step", "ot", 512]]}, "result": [[1.0665418663016199e-05], 0, 1.8456902503967285, 1587110196.504219], "version": 0.2, "tvm_version": "0.7.dev1"}
{"input": ["cuda -model=unknown", "conv2d_NCHWc_int8.cuda", [["TENSOR", [1, 512, 28, 28], "int8"], ["TENSOR", [256, 512, 1, 1], "int8"], [1, 1], [0, 0, 0, 0], [1, 1], "NCHW", "int32"], {}], "config": {"index": 100187431, "code_hash": null, "entity": [["tile_n", "sp", [-1, 1, 1, 1]], ["tile_f", "sp", [-1, 1, 8, 2]], ["tile_y", "sp", [-1, 1, 1, 4]], ["tile_x", "sp", [-1, 1, 28, 1]], ["fuse_yx", "ot", 1], ["tile_rc", "sp", [-1, 16]], ["tile_ry", "sp", [-1, 1]], ["tile_rx", "sp", [-1, 1]], ["reorder_inner", "re", [2, 0, 1]], ["AA_double_buffer", "ot", 1], ["WW_double_buffer", "ot", 1], ["auto_unroll_max_step", "ot", 512]]}, "result": [[1.7627432327737997e-05], 0, 2.188891649246216, 1587112226.8707511], "version": 0.2, "tvm_version": "0.7.dev1"}
{"input": ["cuda -model=unknown", "conv2d_NCHWc_int8.cuda", [["TENSOR", [1, 256, 28, 28], "int8"], ["TENSOR", [256, 256, 3, 3], "int8"], [2, 2], [1, 1, 1, 1], [1, 1], "NCHW", "int32"], {}], "config": {"index": 60029194, "code_hash": null, "entity": [["tile_n", "sp", [-1, 1, 1, 1]], ["tile_f", "sp", [-1, 1, 16, 1]], ["tile_y", "sp", [-1, 1, 1, 2]], ["tile_x", "sp", [-1, 1, 14, 1]], ["fuse_yx", "ot", 1], ["tile_rc", "sp", [-1, 4]], ["tile_ry", "sp", [-1, 3]], ["tile_rx", "sp", [-1, 3]], ["reorder_inner", "re", [0, 2, 1]], ["AA_double_buffer", "ot", 0], ["WW_double_buffer", "ot", 0], ["auto_unroll_max_step", "ot", 1500]]}, "result": [[3.2500846485321843e-05], 0, 2.226564407348633, 1587113621.2016523], "version": 0.2, "tvm_version": "0.7.dev1"}
{"input": ["cuda -model=unknown", "conv2d_NCHWc_int8.cuda", [["TENSOR", [1, 1024, 14, 14], "int8"], ["TENSOR", [256, 1024, 1, 1], "int8"], [1, 1], [0, 0, 0, 0], [1, 1], "NCHW", "int32"], {}], "config": {"index": 27665674, "code_hash": null, "entity": [["tile_n", "sp", [-1, 1, 1, 1]], ["tile_f", "sp", [-1, 1, 16, 1]], ["tile_y", "sp", [-1, 1, 1, 2]], ["tile_x", "sp", [-1, 1, 14, 1]], ["fuse_yx", "ot", 0], ["tile_rc", "sp", [-1, 16]], ["tile_ry", "sp", [-1, 1]], ["tile_rx", "sp", [-1, 1]], ["reorder_inner", "re", [2, 1, 0]], ["AA_double_buffer", "ot", 1], ["WW_double_buffer", "ot", 1], ["auto_unroll_max_step", "ot", 1500]]}, "result": [[1.687275159851301e-05], 0, 1.8312346935272217, 1587115380.6472957], "version": 0.2, "tvm_version": "0.7.dev1"}
{"input": ["cuda -model=unknown", "conv2d_nchw_winograd.cuda", [["TENSOR", [1, 256, 14, 14], "int8"], ["TENSOR", [256, 256, 3, 3], "int8"], [1, 1], [1, 1, 1, 1], [1, 1], "int32"], {}], "config": {"index": 81634, "code_hash": null, "entity": [["tile_b", "sp", [-1, 1, 1, 1]], ["tile_y", "sp", [-1, 1, 8, 8]], ["tile_x", "sp", [-1, 7, 7, 1]], ["tile_rc", "sp", [-1, 16]], ["auto_unroll_max_step", "ot", 1500], ["unroll_explicit", "ot", 1]]}, "result": [[5.584845753523672e-05], 0, 2.2287228107452393, 1587117961.3382697], "version": 0.2, "tvm_version": "0.7.dev1"}
{"input": ["cuda -model=unknown", "conv2d_NCHWc_int8.cuda", [["TENSOR", [1, 256, 14, 14], "int8"], ["TENSOR", [256, 256, 3, 3], "int8"], [1, 1], [1, 1, 1, 1], [1, 1], "NCHW", "int32"], {}], "config": {"index": 81662218, "code_hash": null, "entity": [["tile_n", "sp", [-1, 1, 1, 1]], ["tile_f", "sp", [-1, 1, 16, 1]], ["tile_y", "sp", [-1, 1, 1, 2]], ["tile_x", "sp", [-1, 1, 14, 1]], ["fuse_yx", "ot", 1], ["tile_rc", "sp", [-1, 2]], ["tile_ry", "sp", [-1, 3]], ["tile_rx", "sp", [-1, 3]], ["reorder_inner", "re", [0, 2, 1]], ["AA_double_buffer", "ot", 1], ["WW_double_buffer", "ot", 1], ["auto_unroll_max_step", "ot", 1500]]}, "result": [[2.6787546850185285e-05], 0, 1.8808200359344482, 1587119064.5917106], "version": 0.2, "tvm_version": "0.7.dev1"}
{"input": ["cuda -model=unknown", "conv2d_NCHWc_int8.cuda", [["TENSOR", [1, 256, 14, 14], "int8"], ["TENSOR", [1024, 256, 1, 1], "int8"], [1, 1], [0, 0, 0, 0], [1, 1], "NCHW", "int32"], {}], "config": {"index": 29252756, "code_hash": null, "entity": [["tile_n", "sp", [-1, 1, 1, 1]], ["tile_f", "sp", [-1, 1, 16, 2]], ["tile_y", "sp", [-1, 1, 1, 2]], ["tile_x", "sp", [-1, 1, 14, 1]], ["fuse_yx", "ot", 0], ["tile_rc", "sp", [-1, 8]], ["tile_ry", "sp", [-1, 1]], ["tile_rx", "sp", [-1, 1]], ["reorder_inner", "re", [0, 2, 1]], ["AA_double_buffer", "ot", 0], ["WW_double_buffer", "ot", 0], ["auto_unroll_max_step", "ot", 1500]]}, "result": [[1.5137749905505859e-05], 0, 2.1570026874542236, 1587121675.900573], "version": 0.2, "tvm_version": "0.7.dev1"}
{"input": ["cuda -model=unknown", "conv2d_NCHWc_int8.cuda", [["TENSOR", [1, 1024, 14, 14], "int8"], ["TENSOR", [512, 1024, 1, 1], "int8"], [1, 1], [0, 0, 0, 0], [1, 1], "NCHW", "int32"], {}], "config": {"index": 23425138, "code_hash": null, "entity": [["tile_n", "sp", [-1, 1, 1, 1]], ["tile_f", "sp", [-1, 1, 16, 2]], ["tile_y", "sp", [-1, 1, 1, 2]], ["tile_x", "sp", [-1, 1, 14, 1]], ["fuse_yx", "ot", 0], ["tile_rc", "sp", [-1, 8]], ["tile_ry", "sp", [-1, 1]], ["tile_rx", "sp", [-1, 1]], ["reorder_inner", "re", [0, 1, 2]], ["AA_double_buffer", "ot", 1], ["WW_double_buffer", "ot", 1], ["auto_unroll_max_step", "ot", 512]]}, "result": [[2.642091745994892e-05], 0, 1.812356948852539, 1587123746.1260836], "version": 0.2, "tvm_version": "0.7.dev1"}
{"input": ["cuda -model=unknown", "conv2d_NCHWc_int8.cuda", [["TENSOR", [1, 512, 14, 14], "int8"], ["TENSOR", [512, 512, 3, 3], "int8"], [2, 2], [1, 1, 1, 1], [1, 1], "NCHW", "int32"], {}], "config": {"index": 8326101, "code_hash": null, "entity": [["tile_n", "sp", [-1, 1, 1, 1]], ["tile_f", "sp", [-1, 1, 8, 1]], ["tile_y", "sp", [-1, 1, 1, 1]], ["tile_x", "sp", [-1, 1, 7, 1]], ["fuse_yx", "ot", 0], ["tile_rc", "sp", [-1, 1]], ["tile_ry", "sp", [-1, 3]], ["tile_rx", "sp", [-1, 3]], ["reorder_inner", "re", [0, 2, 1]], ["AA_double_buffer", "ot", 1], ["WW_double_buffer", "ot", 1], ["auto_unroll_max_step", "ot", 1500]]}, "result": [[7.653364437840515e-05], 0, 1.5692858695983887, 1587127455.3789122], "version": 0.2, "tvm_version": "0.7.dev1"}
{"input": ["cuda -model=unknown", "conv2d_NCHWc_int8.cuda", [["TENSOR", [1, 2048, 7, 7], "int8"], ["TENSOR", [512, 2048, 1, 1], "int8"], [1, 1], [0, 0, 0, 0], [1, 1], "NCHW", "int32"], {}], "config": {"index": 1784881, "code_hash": null, "entity": [["tile_n", "sp", [-1, 1, 1, 1]], ["tile_f", "sp", [-1, 2, 1, 1]], ["tile_y", "sp", [-1, 1, 7, 1]], ["tile_x", "sp", [-1, 1, 7, 1]], ["fuse_yx", "ot", 1], ["tile_rc", "sp", [-1, 16]], ["tile_ry", "sp", [-1, 1]], ["tile_rx", "sp", [-1, 1]], ["reorder_inner", "re", [2, 0, 1]], ["AA_double_buffer", "ot", 1], ["WW_double_buffer", "ot", 1], ["auto_unroll_max_step", "ot", 512]]}, "result": [[2.7490345457868765e-05], 0, 1.63079833984375, 1587129031.4627976], "version": 0.2, "tvm_version": "0.7.dev1"}
{"input": ["cuda -model=unknown", "conv2d_nchw_winograd.cuda", [["TENSOR", [1, 512, 7, 7], "int8"], ["TENSOR", [512, 512, 3, 3], "int8"], [1, 1], [1, 1, 1, 1], [1, 1], "int32"], {}], "config": {"index": 267196, "code_hash": null, "entity": [["tile_b", "sp", [-1, 1, 1, 1]], ["tile_y", "sp", [-1, 2, 4, 4]], ["tile_x", "sp", [-1, 1, 8, 2]], ["tile_rc", "sp", [-1, 16]], ["auto_unroll_max_step", "ot", 0], ["unroll_explicit", "ot", 1]]}, "result": [[7.080211854768154e-05], 0, 1.5641117095947266, 1587130198.3084002], "version": 0.2, "tvm_version": "0.7.dev1"}
{"input": ["cuda -model=unknown", "conv2d_NCHWc_int8.cuda", [["TENSOR", [1, 512, 7, 7], "int8"], ["TENSOR", [512, 512, 3, 3], "int8"], [1, 1], [1, 1, 1, 1], [1, 1], "NCHW", "int32"], {}], "config": {"index": 2679608, "code_hash": null, "entity": [["tile_n", "sp", [-1, 1, 1, 1]], ["tile_f", "sp", [-1, 1, 2, 1]], ["tile_y", "sp", [-1, 1, 7, 1]], ["tile_x", "sp", [-1, 1, 7, 1]], ["fuse_yx", "ot", 1], ["tile_rc", "sp", [-1, 2]], ["tile_ry", "sp", [-1, 3]], ["tile_rx", "sp", [-1, 3]], ["reorder_inner", "re", [1, 2, 0]], ["AA_double_buffer", "ot", 1], ["WW_double_buffer", "ot", 1], ["auto_unroll_max_step", "ot", 0]]}, "result": [[6.262797972446063e-05], 0, 1.8751885890960693, 1587132496.495806], "version": 0.2, "tvm_version": "0.7.dev1"}
{"input": ["cuda -model=unknown", "conv2d_NCHWc_int8.cuda", [["TENSOR", [1, 512, 7, 7], "int8"], ["TENSOR", [2048, 512, 1, 1], "int8"], [1, 1], [0, 0, 0, 0], [1, 1], "NCHW", "int32"], {}], "config": {"index": 2166807, "code_hash": null, "entity": [["tile_n", "sp", [-1, 1, 1, 1]], ["tile_f", "sp", [-1, 1, 8, 1]], ["tile_y", "sp", [-1, 7, 1, 1]], ["tile_x", "sp", [-1, 1, 7, 1]], ["fuse_yx", "ot", 1], ["tile_rc", "sp", [-1, 8]], ["tile_ry", "sp", [-1, 1]], ["tile_rx", "sp", [-1, 1]], ["reorder_inner", "re", [1, 0, 2]], ["AA_double_buffer", "ot", 0], ["WW_double_buffer", "ot", 1], ["auto_unroll_max_step", "ot", 512]]}, "result": [[2.348137492844877e-05], 0, 2.2850289344787598, 1587134449.4570491], "version": 0.2, "tvm_version": "0.7.dev1"}
